{
  "version": 1,
  "custom": {
    "repo": "your-org/your-catalog",
    "skills": {}
  },
  "external": {
    "ask-matt": {
      "source": "mattpocock/skills",
      "sourceUrl": "https://github.com/mattpocock/skills.git",
      "skillPath": "skills/engineering/ask-matt/SKILL.md",
      "category": "engineering"
    },
    "code-review": {
      "source": "mattpocock/skills",
      "sourceUrl": "https://github.com/mattpocock/skills.git",
      "skillPath": "skills/engineering/code-review/SKILL.md",
      "category": "engineering"
    },
    "codebase-design": {
      "source": "mattpocock/skills",
      "sourceUrl": "https://github.com/mattpocock/skills.git",
      "skillPath": "skills/engineering/codebase-design/SKILL.md",
      "category": "engineering"
    },
    "diagnosing-bugs": {
      "source": "mattpocock/skills",
      "sourceUrl": "https://github.com/mattpocock/skills.git",
      "skillPath": "skills/engineering/diagnosing-bugs/SKILL.md",
      "category": "engineering"
    },
    "domain-modeling": {
      "source": "mattpocock/skills",
      "sourceUrl": "https://github.com/mattpocock/skills.git",
      "skillPath": "skills/engineering/domain-modeling/SKILL.md",
      "category": "engineering"
    },
    "git-guardrails-claude-code": {
      "source": "mattpocock/skills",
      "sourceUrl": "https://github.com/mattpocock/skills.git",
      "skillPath": "skills/misc/git-guardrails-claude-code/SKILL.md",
      "category": "misc"
    },
    "grill-me": {
      "source": "mattpocock/skills",
      "sourceUrl": "https://github.com/mattpocock/skills.git",
      "skillPath": "skills/productivity/grill-me/SKILL.md",
      "category": "productivity"
    },
    "grill-with-docs": {
      "source": "mattpocock/skills",
      "sourceUrl": "https://github.com/mattpocock/skills.git",
      "skillPath": "skills/engineering/grill-with-docs/SKILL.md",
      "category": "engineering"
    },
    "grilling": {
      "source": "mattpocock/skills",
      "sourceUrl": "https://github.com/mattpocock/skills.git",
      "skillPath": "skills/productivity/grilling/SKILL.md",
      "category": "productivity"
    },
    "handoff": {
      "source": "mattpocock/skills",
      "sourceUrl": "https://github.com/mattpocock/skills.git",
      "skillPath": "skills/productivity/handoff/SKILL.md",
      "category": "productivity"
    },
    "implement": {
      "source": "mattpocock/skills",
      "sourceUrl": "https://github.com/mattpocock/skills.git",
      "skillPath": "skills/engineering/implement/SKILL.md",
      "category": "engineering"
    },
    "improve-codebase-architecture": {
      "source": "mattpocock/skills",
      "sourceUrl": "https://github.com/mattpocock/skills.git",
      "skillPath": "skills/engineering/improve-codebase-architecture/SKILL.md",
      "category": "engineering"
    },
    "improve-react": {
      "source": "millionco/react-doctor",
      "sourceUrl": "https://github.com/millionco/react-doctor.git",
      "skillPath": "skills/improve-react/SKILL.md",
      "category": "improve-react"
    },
    "migrate-to-shoehorn": {
      "source": "mattpocock/skills",
      "sourceUrl": "https://github.com/mattpocock/skills.git",
      "skillPath": "skills/misc/migrate-to-shoehorn/SKILL.md",
      "category": "misc"
    },
    "prototype": {
      "source": "mattpocock/skills",
      "sourceUrl": "https://github.com/mattpocock/skills.git",
      "skillPath": "skills/engineering/prototype/SKILL.md",
      "category": "engineering"
    },
    "react-doctor": {
      "source": "millionco/react-doctor",
      "sourceUrl": "https://github.com/millionco/react-doctor.git",
      "skillPath": "skills/react-doctor/SKILL.md",
      "category": "react-doctor"
    },
    "research": {
      "source": "mattpocock/skills",
      "sourceUrl": "https://github.com/mattpocock/skills.git",
      "skillPath": "skills/engineering/research/SKILL.md",
      "category": "engineering"
    },
    "resolving-merge-conflicts": {
      "source": "mattpocock/skills",
      "sourceUrl": "https://github.com/mattpocock/skills.git",
      "skillPath": "skills/engineering/resolving-merge-conflicts/SKILL.md",
      "category": "engineering"
    },
    "scaffold-exercises": {
      "source": "mattpocock/skills",
      "sourceUrl": "https://github.com/mattpocock/skills.git",
      "skillPath": "skills/misc/scaffold-exercises/SKILL.md",
      "category": "misc"
    },
    "setup-matt-pocock-skills": {
      "source": "mattpocock/skills",
      "sourceUrl": "https://github.com/mattpocock/skills.git",
      "skillPath": "skills/engineering/setup-matt-pocock-skills/SKILL.md",
      "category": "engineering"
    },
    "setup-pre-commit": {
      "source": "mattpocock/skills",
      "sourceUrl": "https://github.com/mattpocock/skills.git",
      "skillPath": "skills/misc/setup-pre-commit/SKILL.md",
      "category": "misc"
    },
    "tdd": {
      "source": "mattpocock/skills",
      "sourceUrl": "https://github.com/mattpocock/skills.git",
      "skillPath": "skills/engineering/tdd/SKILL.md",
      "category": "engineering"
    },
    "teach": {
      "source": "mattpocock/skills",
      "sourceUrl": "https://github.com/mattpocock/skills.git",
      "skillPath": "skills/productivity/teach/SKILL.md",
      "category": "productivity"
    },
    "to-questionnaire": {
      "source": "mattpocock/skills",
      "sourceUrl": "https://github.com/mattpocock/skills.git",
      "skillPath": "skills/productivity/to-questionnaire/SKILL.md",
      "category": "productivity"
    },
    "to-spec": {
      "source": "mattpocock/skills",
      "sourceUrl": "https://github.com/mattpocock/skills.git",
      "skillPath": "skills/engineering/to-spec/SKILL.md",
      "category": "engineering"
    },
    "to-tickets": {
      "source": "mattpocock/skills",
      "sourceUrl": "https://github.com/mattpocock/skills.git",
      "skillPath": "skills/engineering/to-tickets/SKILL.md",
      "category": "engineering"
    },
    "triage": {
      "source": "mattpocock/skills",
      "sourceUrl": "https://github.com/mattpocock/skills.git",
      "skillPath": "skills/engineering/triage/SKILL.md",
      "category": "engineering"
    },
    "wait-what": {
      "source": "mattpocock/skills",
      "sourceUrl": "https://github.com/mattpocock/skills.git",
      "skillPath": "skills/productivity/wait-what/SKILL.md",
      "category": "productivity"
    },
    "wayfinder": {
      "source": "mattpocock/skills",
      "sourceUrl": "https://github.com/mattpocock/skills.git",
      "skillPath": "skills/engineering/wayfinder/SKILL.md",
      "category": "engineering"
    },
    "wizard": {
      "source": "mattpocock/skills",
      "sourceUrl": "https://github.com/mattpocock/skills.git",
      "skillPath": "skills/engineering/wizard/SKILL.md",
      "category": "engineering"
    },
    "writing-for-agents": {
      "source": "mattpocock/skills",
      "sourceUrl": "https://github.com/mattpocock/skills.git",
      "skillPath": "skills/productivity/writing-for-agents/SKILL.md",
      "category": "productivity"
    }
  },
  "vendor": {}
}
